id,statement,description,rating
7038.0,"When it comes to protecting against COVID-19 transmission, neck gaiters are worse than wearing no mask at all.","Are ‘Neck Gaiters’ Worse at COVID-19 Transmission Than Foregoing Masks Altogether?
Rumors claimed that using neck gaiters instead of a mask may actually increase the transmission of the coronavirus.
As governments fight the COVID-19 pandemic, Snopes is fighting an “infodemic” of rumors and misinformation, and you can help. Read our coronavirus fact checks. Submit any questionable rumors and “advice” you encounter. Become a Founding Member to help us hire more fact-checkers. And, please, follow the CDC or WHO for guidance on protecting your community from the disease.


As the world continued to grapple with changing restrictions and recommendations surrounding the coronavirus pandemic, rumors persisted into late summer 2020 regarding scientific understanding behind the effectiveness of certain face coverings used to reduce COVID-19 transmission. In August, a number of news publications reported findings from Duke University research and claimed wearing “neck gaiters” — stretchy, thin articles of clothing worn around the neck to sometimes cover the face — can be worse for transmission than foregoing a mask altogether.
Our research found this claim to be false and largely misreported by some media outlets.
The claim can be traced back to a study published in Science Advances on Aug. 7, 2020. Throughout the course of their research, scientists set out to determine the best methods for testing how to evaluate 14 types of face coverings — not determine which one is the most effective in protecting against transmission. The study was not meant to be a conclusive guide describing which masks to wear, but rather how to test their varied effectiveness. Results regarding the effectiveness of any particular face covering were merely a byproduct of the study.
Science Advances
A simple and cost-effective method for testing the efficacy of certain face coverings is thought to be a crucial element to furthering the understanding of how SARS-CoV-2, the coronavirus responsible for COVID-19, is spread. To that end, the research team turned to optical imaging in order to “highlight stark differences in the effectiveness of different masks and mask alternatives” that may help stop the spread of respiratory droplets, which are known to contain SARS-CoV-2 and can transmit during “regular speech.”
Furthermore, as of mid-2020, there was still much to be determined about the infection pathways of COVID-19, the route of transmission, how to properly use a mask, and how the virus may be affected by environmental variables.
For the proof-of-concept study, which is meant to inform future research, a person wearing a mask stood inside of a dark enclosure and spoke into the direction of a laser beam. Respiratory droplets were visible as they scattered light from the laser beam that a cell phone camera recorded. A simple computer algorithm then counted the droplets. Masks tested included a fitted N95 mask both with and without valves, surgical masks, different variations of polyester or cotton masks, as well as a bandana, and neck fleece, or gaiter. These were then compared against respiratory droplets emitted by a person who wore no face covering.
In short, the study findings concluded that the laser-beam method for viewing, recording, and counting respiratory droplets from analyzed face coverings is a quick and easy way to test their effectiveness. But how well each mask worked was not determined —– that would require further, more specific, evaluation, stricter testing mechanisms, and greater control over variables. Now, other scientists can use this same laser-beam method to specifically test for mask effectiveness.





A fitted N95 mask was determined to be the most effective, since just .1% of droplets were transmitted. A gaiter, on the other hand, was shown to disperse larger droplets into smaller ones, resulting in a higher droplet count than any other face covering and, indeed, than even foregoing a face mask altogether.
“We noticed that speaking through some masks (particularly the neck fleece) seemed to disperse the largest droplets into a multitude of smaller droplets, which explains the apparent increase in droplet count relative to no mask in that case,” wrote the researchers. “Considering that smaller particles are airborne longer than large droplets (larger droplets sink faster), the use of such a mask might be counterproductive.”
Science Advances
Katherine Ellen Foley, a health and science reporter at Quartz, pointed out in a Twitter thread that the research is not without limitations. For starters, test subjects were just talking and not sneezing, coughing, or breathing heavily. Furthermore, the study counted the number of droplets transmitted through each mask — a finding that does not necessarily equate to risk. In all, the research was meant to inform attempts to improve training on proper mask use to determine the safety and efficacy of reusing some masks.
“This was just a demonstration — more work is required to investigate variations in masks, speakers, and how people wear them — but it demonstrates that this sort of test could easily be conducted by businesses and others that are providing masks to their employees or patrons,” said study author Martin Fischer, Ph.D., a chemist and physicist and director of the Advanced Light Imaging and Spectroscopy facility, in a Duke University news release.
Then there is the argument regarding mask material. The researchers only tested gaiters made from fleece. However, different fabrics or materials — like polyester or cotton — could influence how effective a gaiter is in reducing transmission.
Outside experts contended headlines misrepresented the findings by saying that it’s better to wear no mask than a neck gaiter. The Centers for Disease Control and Prevention recommends that people wear masks in public settings and when around people outside of their household, citing evidence that masks are effective in reducing the transmission of COVID-19 and spray of droplets when worn over the nose and mouth.
“If everyone wore a mask, we could stop up to 99% of these droplets before they reach someone else,” said Duke University physician Eric Westman. “In the absence of a vaccine or antiviral medicine, it’s the one proven way to protect others as well as yourself.”",FALSE
6822.785079,Is blue light harmful to our eyes?,"It seems reasonable to reduce exposure to blue light at sunset to mimic the change of light as the sun sets and therefore prompt the brain to start getting ready for sleep, but I have recently seen products advertised that filter out blue light all day, on the grounds that it is harmful to the eyes. Is there any truth in this?",unproven
6837.410945,Are the 'Winter Blues' real?,"I've recently <a href=""https://www.sciencedaily.com/releases/2016/01/160120122808.htm"" target=""_blank"">read </a>that some new science claims to find no evidence for seasonal variations in depression in the US. Can psychologists please verify whether the seasonal affective disorder (SAD) is a real thing? And if so, what treatments are the best? Thanks",TRUE
6852.036811,Is air pollution linked to greater risk of dementia?,"<a href=""https://www.theguardian.com/environment/2018/sep/18/air-pollution-causes-jump-in-dementia-risk-study-suggests"" target=""_blank"">I read a report</a> that air pollution is now linked with dementia - is that true? Thanks.",TRUE
6866.662677,Can eccentric exercises cause human hyperplasia?,With concentric regular exercises muscle hypertrophy may be be induced. But is it possible to cause hyperplasia by following a routine of eccentric exercises.thank you,unproven
6881.288543,Does caffeine help asthma sufferers?,"<a href=""https://www.nytimes.com/2010/11/30/health/30really.html"" target=""_blank"">I read</a> that coffee helps clear airways temporarily for asthma sufferers. Is that true?",unproven
6895.914409,Can you learn in your sleep?,Learning in your sleep. A few years ago this was all the rage - you supposedly could learn a language from tapes under your pillow while you slept. Now it seems to be making a reappearance. Is there any evidence to support this?,TRUE
6910.540275,Is there a link between diet and vasculitis?,Not found,unproven
6925.166141,Does too much screen time damage children's health?,Hearing alot about this for parents - interested in learning about the evidence - and optimal time-frames for kids screen time.. Thanks.,unproven
6939.792007,Do probiotics help with Irritable Bowel Syndrome?,Not found,TRUE
6954.417873,Will contracting Zika virus in childhood impact future fertility or foetal development?,I'm not sure if when a mosquito infects a person with Zika virus its permanently in their system? And whether it is potentially detrimental to future child bearing if a child gets infected. Ultimately this is about whether to avoid areas with Zika carrying Mosquitos for family holidays.,unproven
6969.043739,Does depression have genetic influence?,Is there any link between genetics and depression?,unproven
6983.669605,Is there evidence that plant-based diets increase blood flow?,Not found,unproven
7012.921337,Are artificial sweeteners safe?,"I've heard many claims relating to artificial sweeteners like aspartame and sucralose, <a href=""http://www.independent.co.uk/life-style/health-and-families/health-news/splenda-sucralose-sweeteners-linked-to-leukemia-in-new-study-a6930556.html&quot;"" target=""_blank""> causing everything from cancer </a> to <a href=""http://www.sarahwilson.com/2015/04/can-quitting-artificial-sweetener-reverse-autoimmune-disease/&quot;"" target=""_blank""> auto-immune diseases </a>. Can experts please verify if sweeteners are safe? Thanks.",unproven
7027.547203,Can diet impact sleep?,Not found,TRUE
7042.173069,Can teeth enamel grow back?,Not found,unproven
7056.798935,Does dark chocolate help reduce blood pressure?,"Here is the claim (<a href=""https://www.webmd.com/hypertension-high-blood-pressure/news/20070703/dark-chocolate-may-help-blood-pressure#1"" target=""_blank"">https://www.webmd.com/hypertension-high-blood-pressure/news/20070703/dark-chocolate-may-help-blood-pressure#1</a>)",unproven
7071.424801,Can immunity to diseases vary by populations?,A common explanation for the massive population decreases of isolated societies upon contact with Europeans during the Age of Discovery is that the natives lacked immunity to newly introduced diseases. Does that mean the adult population was not subjected to these pathogens during childhood and is therefore more susceptible to them or is there a genetic component?,unproven
7086.050667,Does smoking decrease the risk of Parkinson's Disease?,"<a href=""https://theconversation.com/smoking-may-protect-against-parkinsons-disease-but-its-more-likely-to-kill-you-60815"" target=""_blank"">I read an article</a> suggesting smoking protects against Parkinson's Disease - is that true?",unproven
7100.676533,Do all meat-based products (even dairy and fish) elevate risk of heart disease?,Not found,unproven
7115.302399,Does dietary soy impact testosterone levels?,Not found,unproven
7144.554131,A photograph shows vintage box of fake snow decor made of the carcinogen asbestos.,"Was Fake Snow Made from Asbestos Marketed as Christmas Decor?
Asbestos was widely used for a variety of purposes before it was recognized as a significant carcinogen.
As Christmas 2017 approached, social media users began circulating an image of a vintage-looking box labeled “Asbestos: Pure White Fire Proof Snow” and questioning if the packaging really contained artificial snow made out of what is now a widely-recognized carcinogen:

In the early half of the 20th Century, asbestos was widely used as Christmas decor because of its white, fluffy appearance — but that was before the substance was recognized as a major risk factor for an aggressive form of cancer known as mesothelio, as the Asbestos.com website reports:
Asbestos was once marketed as artificial snow and sprinkled on trees and wreaths and ornaments. Although those products have not been produced for many years, the oldest decorations that were passed down from one generation to the next, may still have small amounts of asbestos.
The most famous asbestos snow scene was used during the filming of “The Wizard of Oz,” the 1939 classic with Judy Garland that became the most watched film in history. There is a scene in the movie where snow, made from asbestos, falls on Dorothy and her friends, awakening them from a spell cast by the Wicked Witch of the West.
The above displayed above depicts a real item sold to consumers in the mid-20th century. The picture was taken by Tony Rich, an industrial hygienist and amateur photographer who catalogs asbestos images on the photo-sharing platform Flickr using the moniker Asbestos Hunter. Rich, an anti-asbestos activist, originally shot the picture in 2009.
Rich told us he has the actual box in storage and directed us to another photograph that shows the product was manufactured by National Tinsel Manufacturing Company and sold in the late 1940s through the 1950s:
This brand actually contains amphibole asbestos “amosite”, very toxic.
Generally speaking, asbestos was used by the tens of millions of tons for nearly over a century and a half in modern history for a wide variety of applications, mostly due to its fire resistance, insulating properties, durability/strength, inertness, could be woven, and was cheap and abundant.
Major asbestos manufacturers had large [research and development] programs constantly finding new ways to use asbestos. I believe the most tragic use was in cigarette filters.
Rich told us many people are surprised to learn that, despite its significant link to cancer, asbestos isn’t completely banned in the United States. Aside from raising awareness with his camera as “Asbestos Hunter,” Rich serves on the Prevention Advisory Board for the non-profit Asbestos Disease Awareness Organization (ADAO), on whose blog he wrote in 2015:
The United States has a very long history of asbestos usage, a tragic history that continues to be written to this day, to the ultimate detriment of its citizens…our loved ones, neighbors, and future generations.
During that time, tens of millions of tons of asbestos materials were put into our nation’s buildings and infrastructure, most of which remains in place today.
Eventually, laws and regulations were created in an attempt to help protect employees and the public from the toxic legacy left by asbestos. However, despite the volumes of asbestos standards, many still face ongoing problems related to regulatory under-enforcement, poor risk management or by simply failing to identify basic asbestos hazards.
Compounding these issues, asbestos continues to be imported into our country, primarily due to the alarming fact that asbestos has not yet been completely banned. Further, asbestos has been repeatedly found in a wide variety of new consumer products as reported by recent independent studies. Some of these asbestos-containing products include children’s toys and crayons, readily available from retail marketplace’s shelves.",TRUE
7159.179997,Can pharmacokinetic dosing improve patient outcomes in chemotherapy?,"Can Therapeutic Drug Monitoring (TDM), sometimes known as Pharmacokinetic (PK) Dosing, improve patient outcomes and reduce toxicity for patients receiving intravenous chemotherapy?",unproven
7173.805863,Is insomnia permanent?,Not found,FALSE
7188.431729,Does your weight affect sleep?,Not found,unproven
7203.057595,Are all bad habits breakable?,Not found,unproven
7217.683461,Does fasting help metabolic syndrome?,Not found,unproven
7232.309327,Is there any evidence that plant-based GMOs (Genetically modified organisms) pose a significantly greater risk of toxicity or carcinogenicity than the equivalent non-modified foods?,GMOs are becoming more widely used and I want to know if most experts consider this usage safe and supported by evidence from major studies.,unproven
7246.935193,Is the placebo effect getting stronger?,"<a href=""https://qz.com/525995/why-the-placebo-effect-is-getting-stronger/"" target=""_blank"">I read an article</a> suggesting the placebo effect is getting stronger. This would have big implications for drug trials and approvals. Can pharmacology and other medical experts please verify if this is true? Thanks",FALSE
7261.561059,Is intermittent fasting safe?,Not found,TRUE
7276.186925,"Republicans ""voted to allow people with pre-existing mental illness to buy firearms.","What Republicans Did on Mental Health, Guns",FALSE
7290.812791,Is the Flu Vaccine effective?,"I read an <a href=""https://www.vox.com/science-and-health/2018/2/1/16960758/flu-vaccine-effectiveness"" target=""_blank"">article</a> that the 2018 flu vaccine would only prevent about 10% of cases this year. Is this true? Other years? If so, what determines the level of efficacy each year? Thanks",TRUE
7305.438657,Is osteoarthritis reversible?,Not found,unproven
7320.064523,Does music training improve intelligence in children?,,unproven
7334.690389,Are IQ levels in decline?,"I read that the Flynn effect seems to be reversing from <a href=""https://www.news.com.au/technology/science/human-body/the-reverse-of-the-flynn-effect-science-suggests-we-might-be-getting-dumber/news-story/ce3475a0817e65bd6e7710cca8b55074"" target=""_blank"">media reports</a> -and humans are 'getting dumber'. Is that true?",unproven
7349.316255,Does intermittent fasting help diabetes?,Not found,unproven
7363.942121,Is a high-fibre diet good for the microbiome?,"I've heard that fibre helps the gut microbiome - but wanted to ask the experts. Also, if it does - how? Thanks",TRUE
7378.567987,Is intelligence negatively correlated with religious belief?,I've heard many claim this - but never really know if it's really true. Can experts please verify. Thanks,unproven
7393.193853,Does HPV cause cervical cancer?,I've read some articles disputing the link between the human papillomavirus&nbsp;(HPV) and cervical cancer. Can medical researchers please verify this. Thanks,TRUE
7407.819719,Does all dietary protein originate from plants?,"In the Netflix documentary 'The Game Changers', they claim that the animals we eat for our protein needs are mostly herbivores. Since they eat plants for their protein needs, we should 'cut out the middleman' and go straight to the source of protein in plants. Is this true?",unproven
7422.445585,Is there evidence that plant-based diets help erectile dysfunction?,"In the Netflix documentary 'The Game Changers', they claim that plant-based diets give harder, longer erections. Is that true?",unproven
7437.071451,Are there EMF health impacts from high daily use of Bluetooth headphones?,Is there any reason to be concerned&nbsp;that high daily use of Bluetooth headphones (e.g apple AirPods several hours a day) can have negative health effects (cancer or any other neurological)?There has been recent media articles and a signed petition to WHO stating concern with how close the headphone is to the brain given it sits in the ear canal.,unproven
7466.323183,Is intermittent fasting bad for fertility?,Not found,unproven
7480.949049,Does EMDR therapy work?,Is there scientific evidence that Eye Movement Desensitization and Reprocessing (EMDR)&nbsp;therapy works?,TRUE
7495.574915,Are low-carb diets effective?,I've heard many friends &amp; non-scientists claim the effectiveness of low carb diets like Paleo or Keto diets. Can nutrition experts please share the latest scientific evidence regarding whether these low-carb diets are effective at maintaining a healthy weight? What diets do they have to keep them in good health?,unproven
7510.200781,Does a vitamin D deficiency elevate the risk of multiple sclerosis?,"I read a <a href=""https://www.ctvnews.ca/health/low-vitamin-d-levels-linked-to-risk-of-multiple-sclerosis-1.3589305"" target=""_blank"">news article on this</a> and wanted to check with neurologists how solid the evidence is?",TRUE
7524.826647,Is espresso coffee bad for your health?,"I read a <a href=""http://time.com/5033881/health-benefits-of-drinking-coffee/"" target=""_blank"">recent TIME article</a> claiming that overall, long-term consumption of coffee is beneficial to the average person. However, I also read that espresso coffee, which is all my friends and family drink, don't have the same benefits as the American-style filtered variety (polyphenols and cholesterol). Myself and millions of others could never drink the filtered American coffee style from a taste perspective, so I wanted to check with nutrition experts whether excessive espresso is bad for you?",unproven
7539.452513,Can you get all the water you need via food/diet alone?,I went to see a doctor recently and they said they used to work for a kidney specialist who was annoyed by claims that drinking lots of water makes your skin clearer etc. Apparently you can get all the liquid you need through the foods you eat. I was surprised as I had always understood water to be very important and have always tried to drink around 2 litres per day as a goal,unproven
7554.078379,Are sugars worse for you than fats?,,unproven
7194.0,It's NOT a SECOND WAVE of COVID-19 coming soon. It's the NORMAL COLD / FLU SEASON”,The number of COVID-19 cases reported is based on a highly specific diagnostic test for COVID-19; no confusion with flu or common cold is possible,FALSE
7200.0,Are there side effects of taking Vitamin D supplements?,Not found,unproven
7202.0,The U.S. CDC encourages the use of a “[COVID-19] flu shot” on children.,No vaccine contains strains of both the flu and the virus that causes COVID-19; COVID-19 is not the flu,FALSE
7212.0,G]enetic evidence within the Spike gene of SARS-Cov-2 genome […] does exist and suggest that the SARS-CoV-2 genome should be a product of genetic manipulation”; “The characteristics and pathogenic effects of SARS-CoV-2 are unprecedented”,The virus causing COVID-19 most likely evolved in natural wildlife populations before spreading to humans,FALSE
7203.0,Does the overuse of sunscreen impact Vitamin D levels?,Not found,unproven
7201.0,Does vitamin D levels impact the brain?,Not found,unproven
5704.0,Are sulphites bad for you?,Not found,unproven
7205.0,Why don’t we wear masks for [tuberculosis]? Because CNN hasn’t instructed you to.”,Comparisons of tuberculosis and flu with COVID-19 omit important context that explains the different public health responses,FALSE
7263.0,"COVID-19 mortality rates are very low, therefore COVID-19 is not an important public health concern; if you are 70+ years old, you have a 0.054% chance of dying from COVID-19","COVID-19 has caused many deaths due to high virus transmission, despite its relatively small infection fatality ratio",FALSE
7258.0,Is Sweden's approach to addressing the threat of COVID-19 well-supported by evidence?,"There seems to be some dissent among <a href=""https://reaction.life/we-may-already-have-herd-immunity-an-interview-with-professor-sunetra-gupta/?fbclid=IwAR0ucQOKcLEDQNapy0RRFx3TQQ_VhiCANyFWZAzmRoUfHVp8BpablTZxceE"" target=""_blank"">epidemiologists</a> and <a href=""https://www.jacobinmag.com/2020/09/covid-19-pandemic-economy-us-response-inequality"" target=""_blank"">public health researchers</a> on the effectiveness of their approach, hence my attempt to gauge the consensus.",unproven
5643.0,Coronavirus hits 15% fatality rate,"""15% fatality rate"" from coronavirus (2019-nCoV) infection was based only on initial cases; actual rate closer to 3%",FALSE
5688.0,Will eating organic food significantly lower pesticide residue exposure?,,unproven
2740.0,Can people north of 35deg latitude get enough Vitamin D via the sun in winter?,Not found,unproven
