id,statement,description,rating
6149.0,Drinking hot water with lemons will cure or prevent COVID-19; drinking hot water with lemons and sodium bicarbonate will “alkalize the immune system” and cure or prevent COVID-19.,"Will Lemons and Hot Water Cure or Prevent COVID-19?
As cures go, these ones are lemons.
As governments fight the COVID-19 pandemic, Snopes is fighting an “infodemic” of rumors and misinformation, and you can help. Browse our coronavirus fact checks here. Tell us about any questionable or concerning rumors and “advice” you encounter here.

A significant amount of COVID-19 coronavirus disease misinformation spreading across social media or chat apps takes the form of copied-and-pasted “advice” posts attributed to anonymous “experts”. These posts are usually riddled with scientific errors and/or promises of cures. Here we look at two such “cure” posts that involve hot water and lemons.
The Claims
One claim, attributed to a Chinese researcher, implores readers to “use as much natural vitamin C” as possible and suggests lemons as a good source. To that point, the post claims that regular consumption of a drink made from three lemon slices and hot water helps “against the spread of [COVID-19]” and “destroys the virus.” While vitamin C does play a role in several immune system functions, its use as a treatment to prevent or cure viral infections is unsupported by science.
A second, slightly modified claim is attributed to “information” that “comes from Israel” and includes the addition of sodium bicarbonate to the hot lemon water cure. Unlike the previous assertion, which rests largely on claims about vitamin C, this cure allegedly works because it can “alkalize the immune system.” The ubiquity of this concoction in Israel, the post additionally claims, is why the country has seen no cases of the disease. This is false. “Alkalizing the immune system” is an illogical pseudoscientific concept, and at this time of this reporting, Israel had over 2,300 confirmed COVID-19 cases.
Can Hot Lemon ‘Kill the Spread of This Virus’?
This dubious claim, which now circulates in text form on social media platforms, has its origins in a video shared extensively on Facebook messenger and created by the owner of the YouTube channel “MrHealthyChannel.” Even before any medical information is presented, several red flags are apparent. “Hi, I am Jiao Shenme Mingzi from China, Researcher at the School of Medicine Zanjan University,” the post begins. Zanjan University is in Iran, and, as PolitiFact noted, this person’s alleged name closely resembles the phonetic spelling of “jiao shenme mingzi,” which is not a name but a phrase used to ask for someone’s name.
The video and posts derived from transcripts of that video falsely assert that the reason we lack a medical cure for COVID-19, and therefore need a natural remedy that contains vitamin C, is a result of the novel coronavirus’ unexpected or rapid genetic mutation (an issue Snopes addressed here). In reality, this virus is dangerous because of its ability, like other infection-causing viruses, to sustain and replicate in human cells, particularly those of the upper respiratory system.
Though early work had suggested vitamin C as a treatment for the common cold, which is also a viral upper respiratory infection, later work has cast doubt on that notion. In general, no scientific research has shown an ability for vitamin C supplementation to “kill” any upper-respiratory system virus or to reduce its spread. As summarized by the National Institutes of Health (NIH), “the evidence to date suggests that regular intakes of vitamin C at doses of at least 200 mg/per day do not reduce the incidence of the common cold in the general population.” For reference, that single lemon cut into three slices and served with hot water contains about 30 milligrams of vitamin c.
The NIH does suggest that “vitamin C supplements might shorten the duration of the common cold and ameliorate symptom severity” as well as provide some potential benefit to certain populations of people with compromised immune systems. As Dr. Caroline Apovian, a professor of medicine and pediatrics at the Boston University School of Medicine, explained to USA Today, “The only impact that vitamins and supplements may have in any cold or flu is to lessen the severity.”  As such, the assertion that a single lemon served with hot water will “kill the spread of this virus in our body” is unsupported by science.
Can Lemon Help ‘Alkalize the Immune System’?
This iteration of the lemon and hot water cure comes from a viral copy-pasted-and-reshared bit of text on Facebook that usually begins with the false statement that the information comes “from Israel where this virus did not cause any deaths.” As previously noted, Israel has in no way been immune to the coronavirus pandemic, nor are they, as the post also asserts, “relaxed about the virus.” On March 25, the Israeli government announced — like other governments around the world — measures to limit the movement of its citizens in order to slow the disease’s spread.
The alleged science here is just as straightforward to debunk. The ability to “alkalize” one’s body was a popular claim promoted by scientists in the 1920s and by supplement peddlers and health gurus today. But unless you suffer from certain specific and medically catastrophic conditions like metabolic acidosis, it is effectively impossible to alter, through diet, the pH of the cellular environment that makes up the various tissues of your body, including those of the immune system. The body maintains these environments in a tightly controlled range: a pH between 7.36 and 7.44 in arteries, and around 7.2 in intracellular spaces. The only pH value in your body that you would be altering with your diet is the pH of your urine. Such a modification would provide no medical benefit to the fight against a viral infection.
The Bottom Line
Lemon and hot water used as a vitamin C therapy will not “kill” or “slow the spread” of COVID-19, nor would it provide a clinically significant amount of vitamin C to begin with. A buffered solution of hot lemon juice and sodium bicarbonate, similarly, will do nothing to change the pH of either your body or your immune system. For these reasons both lemon-related “cures” are rated “False.”",FALSE
6150.0,There is no ‘coronavirus’,The coronavirus that causes COVID-19 is real; the story that claims otherwise is a work of fiction,FALSE
6153.0,Can convective transport between neighbourhoods contribute to the spread and transmission of airborne viruses?,Can convective transport on a regional scale (or even between neighborhoods in a city) contribute to the spread and transmission of airborne viruses?,unproven
7435.0,Does MSM (Methylsulfonylmethane) have health benefits?,,unproven
7452.0,"We went from 75,000 flu deaths last year in America to almost 0 [...] do you think there may be allocation games being played to manipulate the truth?”","Fewer flu cases observed in the start of this flu season, but Donald Trump Jr.'s tweet suggesting data manipulation is unsupported and cites inaccurate figures",FALSE
7433.0,Is not being able to fall asleep without sound/noise normal?,Not found,unproven
6151.0,Can other countries learn from Asian countries in reducing the spread of SARS-CoV-2?,"As new cases in China <a href=""https://www.worldometers.info/coronavirus/country/china/"" target=""_blank"">decline</a>, while Singapore, Hong Kong and Taiwan have not had massive explosions of numbers like the west, can other countries learn from this?",unproven
7436.0,Is positive psychology / positive thinking for everyone?,"I'm asking this question because of my online friend. He is really into positivity, I am not naturally an optimist nor do I want to be one. I'm mostly wondering if being able to feel and express my own negative emotions and liking talking to people about their negative experiences is a bad thing? He basically said that I should try to look on the bright side and not talk to people about their negative experiences even though I actually like doing that. I get bored really quickly when talking about only good things and Happy Days. I just want to know if this is normal.",unproven
7442.0,Roughly 1 in 4 women in the United States have at least one abortion in their lifetime.,"Do ‘1 in 4’ Women Undergo an Abortion in Their Lifetime?
A commonly cited statistic had a resurgence on social media in October 2020.
In 2019 and 2020, readers asked Snopes to examine the widely shared claim that “1 in 4” women undergo an abortion during their lifetime. In particular, readers cited a viral post on the Facebook page Hashtag, which read:
1 in 4 women will have an abortion in their lifetime. Maybe your mother, sister, cousin, best friend, etc… And while they may not shout it from the mountaintops, they’re reading your posts about how you think they’re garbage human beings for making a choice that they agonized over and was best for them. If it’s not your pregnancy, it’s not your business. And your lack of compassion does not go unnoticed. Mind your own uterus and stop worrying about something that has zero effect on you. 

The same message was shared multiple times on social media and online. The earliest example Snopes found was published on Feb. 2, 2019, but the meme experienced something of a revival in October 2020, for reasons that are unclear. 
The claim that “1 in 4 women” have an abortion in their lifetime has also been used by those opposed to abortion rights, such as Human Coalition:

The figure of “1 in 4 women” appears to derive from an estimate published in the American Journal of Public Health, a peer-reviewed journal, in 2017. As such, it has significant evidentiary backing. However, the data in that study were collected in 2014 and as such, they are at least six years old, as of 2020. Taking into account the possibility that the trend has changed in the past six years, we are issuing a rating of “Mostly True.”
Analysis
The study in question was entitled “Population Group Abortion Rates and Lifetime Incidence of Abortion: United States, 2008–2014” and was authored by Rachel Jones and Jenna Jerman from the research division of the Guttmacher Institute. The article was published in the American Journal of Public Health (AJPH) in November 2017 and can be read in full here. 
Although the meme in question does not contain a citation, it’s likely that it ultimately derives from Jones’ and Jerman’s research, since multiple reports by prominent news outlets and advocacy groups have cited the study in recent years.
The Guttmacher Institute is, in its own description, “committed to advancing sexual and reproductive health and rights in the United States and globally.” As such, it is institutionally in favor of abortion rights. However, its research on abortion trends and legislation is widely regarded as rigorous and of a high standard, as demonstrated in this case by the AJPH’s acceptance of the 2017 study for publication.
A detailed explanation of the study’s methodology is available here, but in brief, the authors used data from the Guttmacher Institute’s 2014 Abortion Patient Survey in order to estimate the cumulative lifetime incidence of abortion among girls and women aged between 15 and 44. The study also used data from the U.S. Census Bureau’s monthly American Community Survey and the National Center for Health Statistics’ National Survey of Family Growth, in order to estimate the national prevalence of abortion. 
Ultimately, the authors estimated that 1.6 percent of girls aged between 15 and 17 had undergone at least one abortion; 4.6 of women aged 18 or 19; 13.3 percent of women aged between 20 and 24; 18.6 percent of 25- to 29-year-olds; 21.5 percent of 30-34 year-olds; 23.1 percent of 35- to 39-year-olds; and by age 44, 23.7 percent of women in the United States had undergone at least one abortion — hence the figure of “1 in 4” — as shown in the following table taken from Jones’ and Jerman’s study:

It’s important to bear in mind that that figure relates to 2014. The Guttmacher Institute confirmed for Snopes that they did not have more recent data on lifetime abortion incidence in the United States, so Jones’ and Jerman’s 2017 article is the best available evidence as of October 2020.
However, the lifetime incidence of abortion among women in the United States may have changed in the intervening six years, and there is good reason to believe it has declined.
According to Guttmacher Institute research, the overall abortion rate (the number of abortions per 1,000 women) in the United States was 21.3 in the year 2000. It dropped to 19.6 in 2008, and fell again to 14.6 in 2014, and again to 13.5 in 2017. If that long-term decline in the prevalence of abortion continued between 2017 and 2020, it stands to reason that the lifetime incidence of abortion also fell below the 23.7 percent estimated in 2014.",mostly-true
6187.0,Is the risk of getting coronavirus from plastic packaging and take-out containers significant?,Not found,unproven
6184.0,An uninsured 17-year-old boy died of COVID-19 symptoms after being refused care due to a lack of medical insurance.,"Did Uninsured Teen Die of COVID-19 After Being Denied Treatment?
A story that went viral was later clarified with regard to key details.
As governments fight the COVID-19 pandemic, Snopes is fighting an “infodemic” of rumors and misinformation, and you can help. Read our coronavirus fact checks. Submit any questionable rumors and “advice” you encounter. Become a Founding Member to help us hire more fact-checkers. And, please, follow the CDC or WHO for guidance on protecting your community from the disease.


In late March 2020, social media users shared an article published by the website Mic with a headline that read, “An uninsured 17-year-old died after being denied care for coronavirus symptoms.” The headline was widely seen and caused outrage and anxiety over health care access amid an ongoing pandemic with a rising death toll.
Citing an article posted by the technology website Gizmodo, as well as comments from a local official, Mic reported, “The teen reportedly felt ill and sought treatment at an urgent care clinic, but was denied. The staff at the facility told the teen to try the emergency room at the local public hospital, Antelope Valley (AV) Hospital,” but the boy died while in transit to the hospital. The Antelope Valley is a community about 45 miles north of the city of Los Angeles.
The claim that the boy was denied medical care for COVID-19 symptoms due to a lack of health coverage originated with comments from Rex Parris, the mayor of the Antelope Valley city of Lancaster, in a video uploaded to the city’s YouTube page. In the video, Parris said the boy had gone to an urgent-care facility for an HMO (health maintenance organization). “He didn’t have insurance, so they did not treat him, and sent him to A.V. (Antelope Valley) Hospital.” The boy went into cardiac arrest on the way to the hospital, Parris said in the video.
After the story went viral, however, Parris clarified his comments in a Facebook post. In that March 29, 2020, post, Parris referred to the boy only as “William” and noted he was the only person to die of the illness in the city as of that writing.
“We have learned more information about William’s death,” Parris wrote. “His family did have health insurance. When the family called his HMO, they were (correctly) told to take him to the emergency room. There was some initial confusion, possibly from language difficulties about the status of health insurance, but the family always had insurance. His family did everything possible to protect William, but this disease is fast and deadly.”
He reiterated much the same in an April 2 interview with Time Magazine. We reached out to Parris by email and have not yet received a response.",mixture
6181.0,Is the risk of catching coronavirus from food or cooking significant?,Not found,unproven
6190.0,A meme documents that plagues occur every 100 years.,"Have Plagues Repeated Exactly Every 100 Years?
The predictive value of cherry-picked data is generally low to insignificant.
As governments fight the COVID-19 pandemic, Snopes is fighting an “infodemic” of rumors and misinformation, and you can help. Read our coronavirus fact checks. Submit any questionable rumors and “advice” you encounter. Become a Founding Member to help us hire more fact-checkers. And, please, follow the CDC or WHO for guidance on protecting your community from the disease.


A common phenomenon that occurs during crises (e.g., natural disasters, political upheaval, terrorist attacks) is attempts by people to assert a sense of certainty and control over events by finding patterns in them, thereby suggesting that whatever is occurring — however chaotic or frightening it may be — is nonetheless natural, predictable, or manageable. So it was with the following meme, which was circulated during the COVID-19 coronavirus disease pandemic in April 2020:

Although this meme couldn’t fairly be classified as “false” (since pandemics of some type were indeed extant during all four of the years it references), it isn’t particularly useful in any informative or predictive sense.
It’s an example of the common technique of creating the impression of a regular pattern by cherry-picking a small amount of (not necessarily relevant) data, while completely ignoring a much larger body of related data that doesn’t fit the desired pattern. Specifically:

The meme omitted every century ending in 20 prior to 1720, even though the occurrence of pandemics has been charted since long before the early 18th century.
The meme comprised only four entries, not a particularly impressive or convincing amount of data (especially in light of the above point).
The meme made no allowance for all the pandemics that spanned years other than those ending in 20 (which might suggest a completely different pattern, or none at all).
The listed pandemics shared no substantive commonality (such as underlying disease, geographic area, duration, extent) that was indicative of any meaningful pattern.

Nonetheless, for those who want to know how “true” the meme is, we offer the following summary of what its entries refer to:

Beginning in 1720, an outbreak of bubonic plague in Marseille, France (known as The Great Plague of Marseille) killed an estimated 100,000 people in that city and surrounding provinces and towns. However, that particular outbreak was far from the first, last, or most severe instance of bubonic plague in history. In particular, the Black Death — a bubonic plague epidemic that hit Eurasia in the 14th century — is estimated to have killed 30% to 60% of Europe’s human population (up to 50 million people), primarily from 1347 to 1351.
The first of several cholera pandemics recorded in modern history spread from India to Southeast Asia, the Middle East, Europe, and Eastern Africa in the early 19th century. However, that pandemic did not begin in 1820. It persisted from 1817 until 1824, and six more cholera pandemics were charted over the following 150 years.
The so-called “Spanish flu” or 1918 flu pandemic (influenza caused by an H1N1 virus) spread in the early 20th century, killing upwards of 50 million people worldwide. (Despite the name, most modern scholarship suggests the pandemic did not actually originate in Spain.) Once again, although that pandemic did encompass the year 1920, it began much earlier, continuing roughly from January 1918 to December 1920.
The COVID-19 coronavirus disease outbreak that made this image of interest in 2020 was initially reported at the end of 2019, but it was not officially characterized as a pandemic by the World Health Organization until March 2020.",mixture
6171.0,SARS-CoV2] is spreading quickly from gas pumps. Shopping carts as well.,"The virus that causes COVID-19 can survive on solid surfaces for days, but infection risk from contaminated objects is unknown",mostly-true
