id,statement,description,rating
7556.0,"In 2011, a Chinese teenager sold his kidney in exchange for cash, which he used to buy an iPhone and an iPad.","Did a Teen Sell His Kidney in Exchange for an iPhone?
Illegal organ trafficking in China had dire consequences for this teenager’s technological aspirations.
Back in 2011, a teenager in China sold his kidney on the organ trafficking black market so he could get enough money to buy the latest Apple devices. The story — which has still circulated on the internet years later because of its shocking details — highlighted the ever-present problem of organ trafficking in China.
The then-17-year-old, identified by the BBC as Xiao Zheng (Little Zheng), and by NPR with the surname Wang, told media that he had wanted to buy an iPad, but couldn’t afford the cost. He communicated with a kidney agent online, and voluntarily sold his right kidney in an illegal procedure that took place in China’s Hunan province. According to Xinhua News Agency, a Chinese media outlet, five people — including the surgeon who performed the procedure — were charged with intentional injury and organ trading. One of the defendants reportedly received 220,000 yuan (about US $33,000) for arranging the transplant, which he split with others involved in the transaction.
The boy received only 22,000 yuan (about US $3,500) from the entire transaction, and used it to purchase an iPad and iPhone, expensive gadgets that made his mother suspicious when he bought them. He eventually admitted to his mother that he had sold a kidney.
Soon afterwards, the boy and his family learned that he suffered from “renal insufficiency,” a decreased level of kidney function, and his condition was deteriorating. As of 2019, the 25-year-old was attached to a dialysis machine, and it was reported that he was likely to be bedridden for life.
China banned the trade of human organs in 2007, but a shortage of donors has led to a booming black market for organs.
Given the corroborating coverage of the story from the BBC, Reuters, and other news outlets, as well as the fact that individuals involved were charged by the government, we rate this claim as “True.”",TRUE
7564.0,Pro-mask study withdrawn after virus spread in counties analyzed by researchers”; “masks don’t work”,Article claiming that “masks don't work” misleads readers by inaccurately interpreting a withdrawn study and a published study conducted on US Marine Corps recruits,FALSE
2185.0,Is it safe to use manure when growing food?,A question about food safety.,unproven
6573.0,5G plays a part in this ‘plandemic’” ... The cases of COVID-19 are “directly related to electromagnetic radiation exposure by 5G”,The spread of COVID-19 is not related in any way to the deployment of 5G,FALSE
1077.0,Three Doritos factory workers have tested positive for Ebola.,"Ebola in Doritos
Have three Doritos factory workers tested positive for Ebola?
Examples:   [Collected via Twitter, November 2014]

3 workers in a Doritos factory were diagnosed with ebola, leading thousands of bags to be infected #EbolaInDoritos 


#EbolaInDoritos !!!!!!!! 4Chan pic.twitter.com/KIJaCejhR0
— Ronald MacKay (@Ronald_MacKay) November 3, 2014


   
Origins:   On 2 November 2014, rumors
began to circulate (mainly via Twitter) that three “Doritos factory workers” had tested positive for the Ebola virus and, consequently, untold numbers of Doritos bags had been potentially contaminated with the virus.
The rumor of Ebola-infected Doritos mimicked a somewhat-similar rumor that a chocolate factory worker in Africa had contaminated Halloween candy after bleeding into batches of food.
However, the Doritos rumor was a false one deliberately promulgated by fabricated news stories. Manufactured images of “breaking news” attributed to large media outlets such CNN and Fox News enabled the claim to spread rapidly:

  


  


Almost as quickly as it started, the Ebola in Doritos claim was exposed as the work of 4chan, a popular message board known for propagating similar pranks. A spokesperson for Frito-Lay addressed the rumor:


Internet rumors associating the Ebola virus with one of our packaged snack foods are absolutely and entirely false. While the Doritos brand is always a hot topic in social media, it is unfortunate someone chose to use this or any brand for such an insensitive prank.


The rumor of Ebola-infected Doritos plant workers is not only false but scientifically contradicted. The Centers for Disease Control (CDC) has explained countless times that Ebola cannot be transmitted through food.",FALSE
6578.0,Wearing a face mask caused a 19-year-old grocery store worker to be hospitalized for an lung infection,Facebook posts spread unsupported anonymous claim that face mask use caused a lung infection in a healthy teenager,FALSE
6590.0,"Wearing a face mask caused a 19-year-old grocery store worker to be hospitalized for a lung infection, due to breathing in her own carbon dioxide and bacteria.",Facebook posts spread unsupported anonymous claim that face mask use caused a lung infection in a healthy teenager,FALSE
7570.0,Lockdowns and face masks do not work to control the COVID-19 pandemic,"Non-pharmaceutical interventions, such as lockdowns and wearing face masks, are effective measures to reduce COVID-19 transmission, contrary to claims in viral video",FALSE
6582.0,Does focusing on the R value for COVID-19 have limitations?,Not found,unproven
6581.0,Can diarrhoea be a symptom of COVID-19?,Not found,unproven
6601.0,Is anxiety always linked to depression?,Not found,unproven
6593.0,Does diet affect anxiety?,Not found,unproven
6626.0,"Vaccinated children are more likely to have adverse health outcomes like developmental delays, asthma, and ear infections compared to unvaccinated children.",Significant methodological flaws in a 2020 study claiming to show unvaccinated children are healthier,FALSE
6634.0,Is skipping breakfast unhealthy for kids?,Not found,unproven
6633.0,Is anxiety bad for your heart?,Not found,unproven
7584.0,Masks make no significant difference”; “Masks have no significant effect”,Danish face mask study did not show that masks were ineffective at reducing spread of COVID-19; study was underpowered and results were inconclusive,FALSE
7587.0,Some mouthwashes containing the antimicrobial ingredient cetylyridinium chloride show signs of reducing COVID-19 in saliva.,"Can Mouthwash ‘Kill’ COVID-19?
Keep your mask on. Preprint studies should always be taken with caution.
As governments fight the COVID-19 pandemic, Snopes is fighting an “infodemic” of rumors and misinformation, and you can help. Read our coronavirus fact checks. Submit any questionable rumors and “advice” you encounter. Become a Founding Member to help us hire more fact-checkers. And, please, follow the CDC or WHO for guidance on protecting your community from the disease.


A preliminary report released in November 2020 claimed that over-the-counter mouthwashes that contained the antimicrobial ingredient cetylyridinium chloride (CPC) showed signs of reducing COVID-19 in saliva — a “promising” find as the world raced to find therapeutics and vaccinations to combat the novel coronavirus.
The findings were published by a long list of news outlets, including BBC News and CNBC, and became a Twitter moment on Nov. 17. Some headlines made bold claims like “Mouthwash Can Kill COVID-19 in 30 Seconds, Study Reveals,” and as such generalized coverage swept the internet, Snopes readers asked our reporters to dig in and verify the veracity of this report.

While it is true that the findings show promise that CPC could reduce COVID-19 in saliva, it is important to note several caveats with the study.
Firstly, the preliminary results are published ahead of a clinical trial in the preprint server for biology bioRxiv, meaning that they have not been peer-reviewed and larger scale testing has yet to be conducted at the time of writing.
Cardiff University researchers behind the most recent mouthwash study conducted an “in vitro” experiment, which means that it was not tested on humans but rather mimicked conditions found in the pharynx passage, the part of the throat located behind the mouth and nasal cavity that connects to the esophagus. Researchers exposed the SARS-CoV-2 novel coronavirus to two rinses containing CPC and a third containing a combination of ethanol and essential oils over the course of 30 seconds.
Mouthwashes that contained at least .07% CPC showed signs of inactivating the novel coronavirus. That doesn’t kill it but rather eliminates the virus’ ability to invade host cells. Neither ethanol nor chlorhexidine alone was shown to have an impact on the virus.
But there are some important limitations to the study worth noting. While mouthwashes were shown to be effective at eradicating the virus in a laboratory setting, it is not yet clear to what extent these results will be mimicked in real people. It also doesn’t directly indicate how mouthwash may reduce viral transmission between patients.
“This study adds to the emerging literature that several commonly available mouthwashes designed to fight gum disease can also inactivate the SARS-CoV-2 coronavirus (and other related coronaviruses) when tested in the laboratory under conditions that are designed to mimic the oral/nasal cavity in a test tube,” said Dr. Richard Stanton, lead author on the study and a reader in virology at Cardiff University, in a university news release.
Despite these limitations, the findings confirm previous studies that suggest CPC could reduce the levels of SARS-CoV-2 in saliva, which could help to reduce transmission between individuals. A study published in The Journal of Infectious Diseases in September found that gargling with an over-the-counter mouthwash for 30 seconds was “highly effective at inactivating infectious virus with greater than 99.9%.” Another study published in October in the British Journal of Oral and Maxillofacial Surgery furthered that saliva and oral cavities may serve as a potential reservoir for COVID-19 transmission, suggesting that mouthwashes could reduce transmission — but again, there is no clinical evidence to date that definitively confirms such findings.
“Overall antimicrobial mouthwash may help in decreasing viral load in the oropharynx but this should not be viewed as using mouthwash instead of face masks, but instead as a potential combined intervention: use of mouthwash and wearing face masks,” said Professor Jean-Yves Maillard, Professor of Pharmaceutical Microbiology at Cardiff University, in a statement.
“The remaining question is how often one needs to use a mouthwash to really make an impact? This would need to be answered before any recommendations are made.”
Listerine owner Johnson & Johnson issued a statement in response to the findings, urging consumers to continue to use products as directed until further clinical evidence proves otherwise. 
No. LISTERINE® mouthwash has not been tested against any strains of coronavirus. Only some LISTERINE® mouthwash formulations contain alcohol, and if present is only around 20% alcohol. LISTERINE® mouthwash is not intended to be used, nor would it be beneficial as a hand sanitizer or surface disinfectant. LISTERINE® Antiseptic is clinically proven to kill 99.9 % of germs that cause bad breath, plaque and gingivitis.
[…]
No. LISTERINE® Antiseptic is a daily mouthwash which has been proven to kill 99.9% of germs that cause bad breath, plaque and gingivitis. LISTERINE® mouthwash has not been tested against the coronavirus and is not intended to prevent or treat COVID-19.
Researchers at Cardiff University intend to next examine how effective mouthwash is in reducing SARS-CoV-2 viral load in the saliva of COVID-19-positive patients at the University Hospital of Wales in Cardiff. Results of this study are slotted for publication in early 2021. At the time of publication, several other studies are underway to determine how effective antiseptic mouthwash may be in preventing COVID-19 spread, including one at the University of California San Francisco that is expected to be completed in August 2021.
Both Listerine and the scientific community caution that using mouthwash is not a cure for COVID-19, nor is it an effective preventative measure. Consumers should continue to follow recommendations issued by the Centers for Disease Control and Prevention, as well as the World Health Organization, including washing hands frequently, maintaining social distance, and avoiding touching the eyes, nose, and mouth.",mixture
6606.0,Are there ways to manage anxiety related to COVID-19?,Not found,unproven
6625.0,Is too much coffee unhealthy?,Not found,unproven
6631.0,Can you take too much Vitamin D?,Not found,TRUE
6620.0,Do hormone levels impact anxiety?,Not found,unproven
6607.0,Should kids confront their bullies?,Not found,unproven
6610.0,Is anxiety genetic?,Not found,unproven
7611.0,COVID-19 vaccines will cause more severe disease through antibody-dependent enhancement,No evidence that COVID-19 vaccines cause more severe disease; antibody-dependent enhancement has not been observed in clinical trials,FALSE
7603.0,"The CDC is setting up COVID-19 containment camps called ""green zones.","Is the CDC Setting Up ‘Green Zones’ or COVID-19 Containment Camps?
A months-old document exploring one possible response to the COVID-19 pandemic was misrepresented on social media.
As governments fight the COVID-19 pandemic, Snopes is fighting an “infodemic” of rumors and misinformation, and you can help. Read our coronavirus fact checks. Submit any questionable rumors and “advice” you encounter. Become a Founding Member to help us hire more fact-checkers. And, please, follow the CDC or WHO for guidance on protecting your community from the disease.


In November 2020, social media users started to spread screenshots that supposedly showed a Centers of Disease Control and Prevention (CDC) document that detailed an alleged plan by the agency to implement “green zones,” or COVID-19 containment camps, to stop the spread of the pandemic:

The CDC is not recommending the implementation of COVID-19 containment camps. This rumor is based on a months-old document that explored the various factors that would have to be considered if “green zones” were ever deemed necessary to control the pandemic. 
Social media users shared cherry-picked screenshots of this document on social media along with  worrisome messages warning that the CDC was advocating for setting up concentration camps. One person, for example, wrote: “Are you effin kidding me?!?!? Fight this!!!! CDC advocating putting high risk people in green zone “camps”?!?!? Away from family members?!?!? Nazi’s!”
These social media posts are based on a genuine page from the CDC website entitled “Interim Operational Considerations for Implementing the Shielding Approach to Prevent COVID-19 Infections in Humanitarian Settings.” While this page, which was first published in July 2020, does talk about “high-risk individuals” being “temporarily relocated to safe or green zones,” describing this document as a CDC “recommendation” or “plan” is inaccurate.
This document presents various factors that would need to be considered before such a plan could be made. In its opening paragraph, it’s explained that “the purpose of this document is to highlight potential implementation challenges of the shielding approach from CDC’s perspective and guide thinking around implementation in the absence of empirical data.” In other words, this document shows that the CDC has started to consider what actions would be required (and what impact they would have on individuals) if such action was deemed necessary.
It should also be noted that in the four months since the publication of document, no such “green zones” or COVID-19 containment camps have been constructed. Rather, the CDC has advocated for the public to wear face masks, wash their hands, and practice social distancing.  
We reached out to the CDC for more information and will update this article accordingly.",mostly-false
7609.0,"Public health measures aimed at reducing the spread of COVID-19 including face masks, vaccines, and frequent handwashing “suppress our immune systems”","Face masks, handwashing, and vaccination do not weaken the immune system, and are effective measures to reduce the spread of infectious diseases",FALSE
7615.0,"Johns Hopkins study mysteriously disappears after it revealed, in spite of COVID, no more deaths in 2020 than in prior years”","CDC data shows higher number of deaths in 2020 compared to previous years; Johns Hopkins student article compared percentages, not raw numbers",FALSE
6624.0,Is vitamin D linked to our genetics?,Not found,unproven
6609.0,Is anxiety healthy?,Not found,TRUE
6579.0,Does COVID-19 affect the brain?,Not found,unproven
6608.0,Is bullying linked to anxiety disorders?,Not found,unproven
7629.0,A participant in a clinical trial of the Pfizer/BioNTech COVID-19 vaccine developed a painful skin reaction on her foot as a result of taking that vaccine.,"Did a Clinical Trial Participant Develop ‘Huge Bleeding Sores’ From a COVID-19 Vaccine?
The claim, which has spread across the anti-vaccine internet zeitgeist without context, stems from a GoFundMe page whose organizer has since walked back her claims.
As governments fight the COVID-19 pandemic, Snopes is fighting an “infodemic” of rumors and misinformation, and you can help. Read our coronavirus fact checks. Submit any questionable rumors and “advice” you encounter. Become a Founding Member to help us hire more fact-checkers. And, please, follow the CDC or WHO for guidance on protecting your community from the disease.


On Nov. 12, 2020, a GoFundMe page titled “Medical and Child Care Expenses” was created by the cousin of a participant involved in a clinical trial of the Pfizer/BioNTech COVID-19 vaccine. Snopes is withholding the participant’s last name for privacy reasons. 
“Patricia was involved in a COVID-19 vaccine study recently and has had a severe adverse reaction,” the post originally stated. “She has not been able to walk or go to work for almost three weeks now because of huge bleeding sores on her feet. These sores are called a Fixed Drug Eruption…”
Screenshots from this GoFundMe page have since been used as evidence of the danger of the COVID-19 vaccine on Facebook, Twitter, and fringe news websites, each of which blindly assert a causal connection between the Pfizer/BioNTech COVID-19 vaccine and the foot sores, based on these pictures:

On Nov. 30, 2020, however, the creator of the GoFundMe page told potential donors that Patricia had learned she was actually in the control group — i.e., people given an injection of saline solution instead of the actual vaccine for comparison purposes:
Patricia is still suffering from the painful skin condition on her feet; however, the cause has become unclear.  The manufacturer of the vaccine has unblinded her due to this safety concern and it has been discovered she was in the placebo arm of the trial.
In other words, the vaccine could not have caused this condition because she was never actually given the vaccine. In a video update, Patricia stated, “So just to clarify … the vaccine manufacturer is standing their ground that I received the placebo, which is allegedly just sterile saline. … I’m going to seek a second opinion because I don’t know what the hell caused this.” We reached out to the organizer of the GoFundMe to see if there had been any medical updates in her case, but have not received a response.
We reached out to Pfizer to confirm Patricia’s account of events. In response, they told us:
This individual was enrolled in a Pfizer COVID-19 vaccine trial, as she has disclosed. We can definitively state, however, that this individual’s medical condition (alleged “Fixed Drug Eruption”) is not related to her participation in the trial. We have contacted GoFundMe on two occasions regarding this matter, and as a result, the site has shut down the related fundraising page. More generally, as stated in our press release, no serious safety concerns have been observed in our trial.
While GoFundMe told us that they did temporarily remove the fundraiser, they restored the page after updated information was provided:
The fundraiser was initially suspended by our Trust & Safety team. As a general point, fundraisers whose claims cannot be verified violate GoFundMe’s Terms of Service and will be removed from the platform. After receiving more information from the organizer, the fundraiser is again actively receiving donations. I’ll point you to their latest updates.
We’re a site that requires transparency and because the intent of the fundraiser has changed, we asked the organizer to post an update for donors. GoFundMe is honoring any refund requests which is part of our comprehensive refund policy to ensures donors’ intentions are honored.
However, because the alleged victim of the COVID-19 trial publicly disclosed that she had been informed that she was in the placebo group, and because Pfizer has told us they can “definitively state … that this individual’s medical condition is not related to her participation in the trial,” we rank the claim that the Pfizer/BioNTech COVID-19 vaccine caused painful foot sores as “False.”",FALSE
6644.0,"Vaccinated children are more likely to have adverse health outcomes like developmental delays, asthma, and ear infections compared to unvaccinated children.",Significant methodological flaws in a 2020 study claiming to show unvaccinated children are healthier,FALSE
6647.0,A video shows a group of people celebrating the end of COVID-19 restrictions in New Zealand.,"Are These New Zealanders Celebrating the End of COVID-19 Restrictions?
In June 2020, New Zealand lifted all social distancing restrictions related to the COVID-19 pandemic after going two weeks without a confirmed case.
On June 9, 2020, a video supposedly showing a group of people at a bar excitedly celebrating the end of coronavirus stay-at-home restrictions in New Zealand went viral on social media:
 New Zealanders celebrating having eliminated COVID-19 as soon as the country went into level 1 (no more social distancing) from      nextfuckinglevel 
 
This video came as a surprise to some viewers during a time when most of the world, including the United States, is still dealing with the social distancing, business restrictions, and other safety policies put in place to combat COVID-19. 
The above-displayed video is real and truly shows a group celebrating the end of COVID-19 restrictions in New Zealand. This video was taken at Danger Danger bar in Wellington as the clock struck midnight on June 9, 2020, ending the country’s social distancing enforcement. 
Matt McLaughlin, the owner of Danger Danger, told Australia’s Stuff news outlet the following:
“It’s a great video of midnight hitting and everyone jumping off their chairs and jumping on the dance floor. It’s quite hard case… People want to socialise. They’ve been cooped up for three months, and they want to get out and see their friends.”
According to the BBC, the above-displayed video captured the moment that New Zealand officially moved to a “level one” on their four-tier alert system, meaning that all social distancing guidelines put in place during the pandemic were removed. There are now no limits on public gatherings (which means sports, concerts, and other large public gatherings can take place) and effectively no restrictions on business operations.
But one COVID-19 policy remains: New Zealand’s borders will remain closed to foreigners for the time being. 
While Prime Minister Jacinda Ardern was not at the Danger Danger bar the when the video was taken, she did tell reporters that she did a “little dance” when she learned that New Zealand no longer had any active cases of COVID-19:
“While we’re in a safer, stronger position, there’s still no easy path back to pre-Covid life, but the determination and focus we have had on our health response will now be vested in our economic rebuild … While the job is not done, there is no denying this is a milestone. So can I finish with a very simple, ‘Thank you, New Zealand’.”",TRUE
6661.0,Does marijuana help reduce anxiety?,Not found,unproven
6630.0,Does vitamin D protect against COVID-19?,Not found,unproven
