id,statement,description,rating
6771.0,"Dawn dish soap contains ammonia even though it's not listed as an ingredient, and when mixed with Clorox bleach products, the results could be lethal.","Could Mixing Dawn Dish Soap with Clorox Bleach Kill You?
Public health officials urge against mixing cleaning products to avoid toxic results.
In June 2020, Snopes received numerous inquires from readers wondering if mixing Dawn dish soap with Clorox bleach products during household cleaning sprees could emit a toxic gas that would kill them.
The question largely seemed to stem from social media posts and blog entries suggesting that that brand of dish soap contained ammonia and, when mixed with bleach, could create hazardous fumes. One Michigan-based DIY lifestyle blogger wrote:
Last week I was researching some unexpected homemade stain removers and that got me thinking about another homemade laundry product – my homemade no-grate laundry soap made with Dawn dish soap. …BUT – not that long ago when I looked at the back of the bottle of Dawn dish soap I spotted these tiny words:  “Do Not Add Bleach”. .. Apparently the warnings found on some dish soaps that you should not add bleach stems from this potential chemical reaction [of ammonia and bleach].

Upon our analysis of similar blog entries and posts, we determined the most popular claim to be this: Dawn dish soap contains ammonia even though it’s not listed as an ingredient, and when mixed with Clorox bleach products, the results could be lethal.
Firstly, to investigate the assertion, let this be known: ammonia, a compound of nitrogen and hydrogen (NH₃), is a colorless gas with a distinct, suffocating odor. It dissolves easily in water to create ammonium hydroxide, which is commonly used in low concentration to make a variety of household and industrial-strength cleaning products, specifically some glass and window cleaners.
Sodium hypochlorite is the active ingredient in chlorine bleach and is similarly diluted and mixed with other ingredients to make several household disinfectants, including many Clorox products for stain and soil cleaning.
And when bleach is mixed with ammonia, yes, a toxic gas called chloramine is released into the air and can cause the following symptoms for people who breathe it in, according to the Washington State Department of Health:

Coughing.
Nausea.
Shortness of breath.
Watery eyes.
Chest pain.
Irritation to the throat, nose, and eyes.
Wheezing.
Pneumonia and fluid in the lungs

And in high concentrations, the gas can force people into comas or be deadly. Clorox states on its website:
Bleach and ammonia should NEVER be mixed since when the two combine, toxic gas is formed that could be fatal.  And it’s not just ammonia or products containing ammonia (like window cleaner) that can be a problem. Therefore, as a general rule, bleach should not be mixed with other household cleaners such as toilet bowl cleaners, rust removers, and acids (vinegar, for example) since toxic gas can also form.
(If you do accidentally mix bleach and ammonia and feel one or more of the above-listed symptoms, immediately leave the contaminated area and call 911 or the American Association of Poison Control Centers 1-800-222-1222.)
Now, we move on to the part of the claim regarding the composition and ingredient lists for Dawn dish soap. To determine whether the soaps contain ammonia and, therefore, should not be mixed with Clorox bleach products, we reviewed dozens of Safety Data Sheets — which outline product ingredient information as part of the United Nation’s system for classifying and labeling chemicals — for the following types of soap:
Dawn Ultra Lemon, Ultra Dawn Original, Ultra Dawn Peach Sunrise, Dawn Ultra Plus Heavy Duty, Dawn Simply Clean Original, Dawn Ultra Berry Time Blast, Dawn Original Non-Concentrated, Dawn Ultra Plus Advanced Power, Dawn Ultra Botanicals Lavender, Ultra Dawn Free and Gentle, Dawn Simply Clean Apple Blossom, Dawn Ultra Antibacterial Orange, Dawn Ultra Pomegranate Awakening, Dawn Ultra Apple Orchard Harvest, Dawn Ultra Botanicals Aloe Water, Dawn Professional Dish Detergent, Ultra Dawn Platinum Vibrant Fresh, Ultra Dawn Platinum Advanced Power, Dawn Apple Blossom Non-Concentrated, Ultra Dawn Platinum Advanced Power, Dawn Pure Essentials Lavender Wisp, Dawn Pure Essentials Lemon Essence, Ultra Dawn Platinum Refreshing Rain, Dawn Simply Clean Summertime Showers, Dawn Ultra Botanicals Cherry Blossom, Ultra Dawn Escapes Malibu Sunrise, Ultra Dawn Escapes Fuji Cherry Blossom, Dawn Ultra Antibacterial Apple Blossom, Dawn Pure Essentials Lavender Wisp, Dawn Summertime Showers Non-Concentrated, Ultra Dawn Escapes Thai Dragonfruit, Ultra Dawn Escapes Caribbean Breeze, Dawn Platinum Erasing Foam Fresh Rapids, Dawn Ultra Botanicals Hawaiian Pineapple, Dawn Powerwash Dish Spray – Apple, Dawn Ultra Power Dissolver, Dawn Ultra Gentle Clean Peach and Almond, Ultra Dawn Antibacterial Hand Soap Orange, Ultra Dawn Escapes Hawaiian Pineapple, Dawn Ultra Botanicals New Zealand Springs, Ultra Dawn Pure Essentials Sparkling Mist, Dawn Ultra Botanicals Fuji Cherry Blossom, Dawn Ultra Gentle Clean Pomegranate Splash, Ultra Dawn Hand Renewal Cucumber and Melon, Ultra Dawn Escapes New Zealand Springs, Ultra Dawn Platinum Oxi Invigorating Berry, Dawn Ultra Plus Power Clean Refreshing Rain, Dawn Platinum Dishwashing Foam Fresh Rapids, Dawn Ultra Gentle Clean Green Tea and Honey, Dawn Ultra Botanicals Mediterranean Lavender, Dawn Ultra Total Clean – Pomegranate Awakening, Dawn Ultra Platinum Stainfighter Lemon Burst, Ultra Dawn Escapes Mediterranean Lavender, Bounty with Dawn, Dawn Platinum Powerwash Dish Spray Apple Scent, Dawn Platinum Powerwash Dish Spray Fresh Scent, Dawn Platinum Powerwash Dish Spray Citrus Scent, Ultra Dawn Antibacterial Hand Soap Apple Blossom, Cascade Advanced Power Dishwasher Powder with Dawn, Dawn Ultra Gentle Clean Pomegranate And Rose Water, Ultra Dawn Platinum Bleach Alternative Morning Mist, Dawn Hand Renewal with Olay Cool Springs, Dawn Hand Renewal with Olay Refreshing Mint, Dawn Ultra Plus Hand Renewal Waterfall Mist, Dawn Professional Multi-Surface Heavy Duty Degreaser Concentrate, Mr. Clean Liquid Muscle Multi-Purpose Cleaner with the Power of Dawn, Dawn Professional Manual Pot and Pan Detergent Lemon Scent – Concentrate, Dawn Wash Away Bacteria Dishwashing Liquid Hand Soap Lemon, Dawn Platinum Bleach Alternative Dishwashing Liquid Fresh Rapids, and Dawn Platinum Bleach Stain Fighter Dishwashing Liquid, Lemon Burst
None of the documents listed any form of ammonia as part of Dawn products’ composition or ingredients, which means it is false to assert that the dish cleaners contain the compound that causes a toxic gas when mixed with bleach. Additionally, it’s false to claim that Dawn is nefariously putting ammonia in its products while omitting it from ingredient lists. 
Supporting our analysis of the Safety Data Sheets, a representative Proctor & Gamble, which owns the Dawn brand, told Snopes via email:
Dawn dish soap is not formulated using ammonia. That does not mean it should ever be combined with other cleaning products. In general, combining two cleaning products can cause harmful reactions, so like all cleaning products, we always recommend using Dawn by itself to get the job done. 
Public health officials ask people to heed similar advice in regards to DIY cleaning concoctions. The Centers for Disease and Control (CDC) states on its website: “avoid mixing chemical products” and “never mix household bleach with ammonia or any other cleanser”.
In sum, since mixing bleach and ammonia can be deadly, it’s accurate to state that people should not combine Clorox bleach products with cleaners that contain ammonia; however, it is false to assert that Dawn dish soaps contain ammonia and/or that the company is nefariously leaving the compound off ingredient lists. For those reasons, we rate this claim a “Mixture” of true and untrue information.",mixture
2468.0,Is blue light harmful to our eyes?,"It seems reasonable to reduce exposure to blue light at sunset to mimic the change of light as the sun sets and therefore prompt the brain to start getting ready for sleep, but I have recently seen products advertised that filter out blue light all day, on the grounds that it is harmful to the eyes. Is there any truth in this?",unproven
1929.0,Are the 'Winter Blues' real?,"I've recently <a href=""https://www.sciencedaily.com/releases/2016/01/160120122808.htm"" target=""_blank"">read </a>that some new science claims to find no evidence for seasonal variations in depression in the US. Can psychologists please verify whether the seasonal affective disorder (SAD) is a real thing? And if so, what treatments are the best? Thanks",TRUE
1872.0,Is air pollution linked to greater risk of dementia?,"<a href=""https://www.theguardian.com/environment/2018/sep/18/air-pollution-causes-jump-in-dementia-risk-study-suggests"" target=""_blank"">I read a report</a> that air pollution is now linked with dementia - is that true? Thanks.",TRUE
1956.0,Can eccentric exercises cause human hyperplasia?,With concentric regular exercises muscle hypertrophy may be be induced. But is it possible to cause hyperplasia by following a routine of eccentric exercises.thank you,unproven
2634.0,Does caffeine help asthma sufferers?,"<a href=""https://www.nytimes.com/2010/11/30/health/30really.html"" target=""_blank"">I read</a> that coffee helps clear airways temporarily for asthma sufferers. Is that true?",unproven
3064.0,Can you learn in your sleep?,Learning in your sleep. A few years ago this was all the rage - you supposedly could learn a language from tapes under your pillow while you slept. Now it seems to be making a reappearance. Is there any evidence to support this?,TRUE
2745.0,Is there a link between diet and vasculitis?,Not found,unproven
2103.0,Does too much screen time damage children's health?,Hearing alot about this for parents - interested in learning about the evidence - and optimal time-frames for kids screen time.. Thanks.,unproven
799.0,Do probiotics help with Irritable Bowel Syndrome?,Not found,TRUE
2131.0,Will contracting Zika virus in childhood impact future fertility or foetal development?,I'm not sure if when a mosquito infects a person with Zika virus its permanently in their system? And whether it is potentially detrimental to future child bearing if a child gets infected. Ultimately this is about whether to avoid areas with Zika carrying Mosquitos for family holidays.,unproven
3107.0,Does depression have genetic influence?,Is there any link between genetics and depression?,unproven
5451.0,Is there evidence that plant-based diets increase blood flow?,Not found,unproven
2075.0,Are artificial sweeteners safe?,"I've heard many claims relating to artificial sweeteners like aspartame and sucralose, <a href=""http://www.independent.co.uk/life-style/health-and-families/health-news/splenda-sucralose-sweeteners-linked-to-leukemia-in-new-study-a6930556.html&quot;"" target=""_blank""> causing everything from cancer </a> to <a href=""http://www.sarahwilson.com/2015/04/can-quitting-artificial-sweetener-reverse-autoimmune-disease/&quot;"" target=""_blank""> auto-immune diseases </a>. Can experts please verify if sweeteners are safe? Thanks.",unproven
5191.0,Can diet impact sleep?,Not found,TRUE
5058.0,Can teeth enamel grow back?,Not found,unproven
2078.0,Does dark chocolate help reduce blood pressure?,"Here is the claim (<a href=""https://www.webmd.com/hypertension-high-blood-pressure/news/20070703/dark-chocolate-may-help-blood-pressure#1"" target=""_blank"">https://www.webmd.com/hypertension-high-blood-pressure/news/20070703/dark-chocolate-may-help-blood-pressure#1</a>)",unproven
2034.0,Can immunity to diseases vary by populations?,A common explanation for the massive population decreases of isolated societies upon contact with Europeans during the Age of Discovery is that the natives lacked immunity to newly introduced diseases. Does that mean the adult population was not subjected to these pathogens during childhood and is therefore more susceptible to them or is there a genetic component?,unproven
1945.0,Does smoking decrease the risk of Parkinson's Disease?,"<a href=""https://theconversation.com/smoking-may-protect-against-parkinsons-disease-but-its-more-likely-to-kill-you-60815"" target=""_blank"">I read an article</a> suggesting smoking protects against Parkinson's Disease - is that true?",unproven
5450.0,Do all meat-based products (even dairy and fish) elevate risk of heart disease?,Not found,unproven
5452.0,Does dietary soy impact testosterone levels?,Not found,unproven
5460.0,A photograph shows vintage box of fake snow decor made of the carcinogen asbestos.,"Was Fake Snow Made from Asbestos Marketed as Christmas Decor?
Asbestos was widely used for a variety of purposes before it was recognized as a significant carcinogen.
As Christmas 2017 approached, social media users began circulating an image of a vintage-looking box labeled “Asbestos: Pure White Fire Proof Snow” and questioning if the packaging really contained artificial snow made out of what is now a widely-recognized carcinogen:

In the early half of the 20th Century, asbestos was widely used as Christmas decor because of its white, fluffy appearance — but that was before the substance was recognized as a major risk factor for an aggressive form of cancer known as mesothelio, as the Asbestos.com website reports:
Asbestos was once marketed as artificial snow and sprinkled on trees and wreaths and ornaments. Although those products have not been produced for many years, the oldest decorations that were passed down from one generation to the next, may still have small amounts of asbestos.
The most famous asbestos snow scene was used during the filming of “The Wizard of Oz,” the 1939 classic with Judy Garland that became the most watched film in history. There is a scene in the movie where snow, made from asbestos, falls on Dorothy and her friends, awakening them from a spell cast by the Wicked Witch of the West.
The above displayed above depicts a real item sold to consumers in the mid-20th century. The picture was taken by Tony Rich, an industrial hygienist and amateur photographer who catalogs asbestos images on the photo-sharing platform Flickr using the moniker Asbestos Hunter. Rich, an anti-asbestos activist, originally shot the picture in 2009.
Rich told us he has the actual box in storage and directed us to another photograph that shows the product was manufactured by National Tinsel Manufacturing Company and sold in the late 1940s through the 1950s:
This brand actually contains amphibole asbestos “amosite”, very toxic.
Generally speaking, asbestos was used by the tens of millions of tons for nearly over a century and a half in modern history for a wide variety of applications, mostly due to its fire resistance, insulating properties, durability/strength, inertness, could be woven, and was cheap and abundant.
Major asbestos manufacturers had large [research and development] programs constantly finding new ways to use asbestos. I believe the most tragic use was in cigarette filters.
Rich told us many people are surprised to learn that, despite its significant link to cancer, asbestos isn’t completely banned in the United States. Aside from raising awareness with his camera as “Asbestos Hunter,” Rich serves on the Prevention Advisory Board for the non-profit Asbestos Disease Awareness Organization (ADAO), on whose blog he wrote in 2015:
The United States has a very long history of asbestos usage, a tragic history that continues to be written to this day, to the ultimate detriment of its citizens…our loved ones, neighbors, and future generations.
During that time, tens of millions of tons of asbestos materials were put into our nation’s buildings and infrastructure, most of which remains in place today.
Eventually, laws and regulations were created in an attempt to help protect employees and the public from the toxic legacy left by asbestos. However, despite the volumes of asbestos standards, many still face ongoing problems related to regulatory under-enforcement, poor risk management or by simply failing to identify basic asbestos hazards.
Compounding these issues, asbestos continues to be imported into our country, primarily due to the alarming fact that asbestos has not yet been completely banned. Further, asbestos has been repeatedly found in a wide variety of new consumer products as reported by recent independent studies. Some of these asbestos-containing products include children’s toys and crayons, readily available from retail marketplace’s shelves.",TRUE
4903.0,Can pharmacokinetic dosing improve patient outcomes in chemotherapy?,"Can Therapeutic Drug Monitoring (TDM), sometimes known as Pharmacokinetic (PK) Dosing, improve patient outcomes and reduce toxicity for patients receiving intravenous chemotherapy?",unproven
5267.0,Is insomnia permanent?,Not found,FALSE
5298.0,Does your weight affect sleep?,Not found,unproven
6775.0,Are all bad habits breakable?,Not found,unproven
5114.0,Does fasting help metabolic syndrome?,Not found,unproven
4874.0,Is there any evidence that plant-based GMOs (Genetically modified organisms) pose a significantly greater risk of toxicity or carcinogenicity than the equivalent non-modified foods?,GMOs are becoming more widely used and I want to know if most experts consider this usage safe and supported by evidence from major studies.,unproven
444.0,Is the placebo effect getting stronger?,"<a href=""https://qz.com/525995/why-the-placebo-effect-is-getting-stronger/"" target=""_blank"">I read an article</a> suggesting the placebo effect is getting stronger. This would have big implications for drug trials and approvals. Can pharmacology and other medical experts please verify if this is true? Thanks",FALSE
5077.0,Is intermittent fasting safe?,Not found,TRUE
39.0,"Republicans ""voted to allow people with pre-existing mental illness to buy firearms.","What Republicans Did on Mental Health, Guns",FALSE
4593.0,Is the Flu Vaccine effective?,"I read an <a href=""https://www.vox.com/science-and-health/2018/2/1/16960758/flu-vaccine-effectiveness"" target=""_blank"">article</a> that the 2018 flu vaccine would only prevent about 10% of cases this year. Is this true? Other years? If so, what determines the level of efficacy each year? Thanks",TRUE
86.0,Is osteoarthritis reversible?,Not found,unproven
4833.0,Does music training improve intelligence in children?,,unproven
3141.0,Are IQ levels in decline?,"I read that the Flynn effect seems to be reversing from <a href=""https://www.news.com.au/technology/science/human-body/the-reverse-of-the-flynn-effect-science-suggests-we-might-be-getting-dumber/news-story/ce3475a0817e65bd6e7710cca8b55074"" target=""_blank"">media reports</a> -and humans are 'getting dumber'. Is that true?",unproven
5163.0,Does intermittent fasting help diabetes?,Not found,unproven
4577.0,Is a high-fibre diet good for the microbiome?,"I've heard that fibre helps the gut microbiome - but wanted to ask the experts. Also, if it does - how? Thanks",TRUE
4622.0,Is intelligence negatively correlated with religious belief?,I've heard many claim this - but never really know if it's really true. Can experts please verify. Thanks,unproven
1859.0,Does HPV cause cervical cancer?,I've read some articles disputing the link between the human papillomavirus&nbsp;(HPV) and cervical cancer. Can medical researchers please verify this. Thanks,TRUE
5447.0,Does all dietary protein originate from plants?,"In the Netflix documentary 'The Game Changers', they claim that the animals we eat for our protein needs are mostly herbivores. Since they eat plants for their protein needs, we should 'cut out the middleman' and go straight to the source of protein in plants. Is this true?",unproven
5448.0,Is there evidence that plant-based diets help erectile dysfunction?,"In the Netflix documentary 'The Game Changers', they claim that plant-based diets give harder, longer erections. Is that true?",unproven
5449.0,Are there EMF health impacts from high daily use of Bluetooth headphones?,Is there any reason to be concerned&nbsp;that high daily use of Bluetooth headphones (e.g apple AirPods several hours a day) can have negative health effects (cancer or any other neurological)?There has been recent media articles and a signed petition to WHO stating concern with how close the headphone is to the brain given it sits in the ear canal.,unproven
5115.0,Is intermittent fasting bad for fertility?,Not found,unproven
5205.0,Does EMDR therapy work?,Is there scientific evidence that Eye Movement Desensitization and Reprocessing (EMDR)&nbsp;therapy works?,TRUE
4762.0,Are low-carb diets effective?,I've heard many friends &amp; non-scientists claim the effectiveness of low carb diets like Paleo or Keto diets. Can nutrition experts please share the latest scientific evidence regarding whether these low-carb diets are effective at maintaining a healthy weight? What diets do they have to keep them in good health?,unproven
4698.0,Does a vitamin D deficiency elevate the risk of multiple sclerosis?,"I read a <a href=""https://www.ctvnews.ca/health/low-vitamin-d-levels-linked-to-risk-of-multiple-sclerosis-1.3589305"" target=""_blank"">news article on this</a> and wanted to check with neurologists how solid the evidence is?",TRUE
2088.0,Is espresso coffee bad for your health?,"I read a <a href=""http://time.com/5033881/health-benefits-of-drinking-coffee/"" target=""_blank"">recent TIME article</a> claiming that overall, long-term consumption of coffee is beneficial to the average person. However, I also read that espresso coffee, which is all my friends and family drink, don't have the same benefits as the American-style filtered variety (polyphenols and cholesterol). Myself and millions of others could never drink the filtered American coffee style from a taste perspective, so I wanted to check with nutrition experts whether excessive espresso is bad for you?",unproven
5211.0,Can you get all the water you need via food/diet alone?,I went to see a doctor recently and they said they used to work for a kidney specialist who was annoyed by claims that drinking lots of water makes your skin clearer etc. Apparently you can get all the liquid you need through the foods you eat. I was surprised as I had always understood water to be very important and have always tried to drink around 2 litres per day as a goal,unproven
2120.0,Are sugars worse for you than fats?,,unproven
1579.0,Do detox diets offer any health benefits?,There are an infinite number of diets claiming to provide detoxification or cleansing health benefits. Is their scientific evidence that these diets do this and actually help your health?,FALSE
4578.0,Do routine mammograms save lives?,"I read an article <a href=""https://theconversation.com/routine-mammograms-do-not-save-lives-the-research-is-clear-84110"" target=""_blank"">suggesting routine mammograms don't save lives </a>and then another <a href=""https://theconversation.com/routine-mammograms-do-save-lives-the-science-85517"" target=""_blank"">suggesting they do</a>. Can experts please share us their perspective and answer on this important question. Many thanks.",TRUE
463.0,Will the world eventually run out of effective antibiotics?,"Are we inevitably going to run out of effective medicines against antimicrobial resistance? Can we theoretically continue to develop more indefinitely, or will there come a point where we simply won't be able to discover new drugs at a fast enough rate? <a href=""https://www.irishtimes.com/news/health/the-world-is-running-out-of-antibiotics-who-warns-1.3227547"" target=""_blank"">Source</a>",unproven
4719.0,Do our bodies have 10-times more bacteria than human cells?,I've this claim many times and wondered if there was scientific evidence backing it up?,unproven
586.0,Is bat faeces dangerous?,Not found,unproven
2056.0,Is there a correlation between grades and intelligence?,,TRUE
2895.0,Are turmeric supplements worth it for already healthy people?,Not found,unproven
5208.0,Does using too much soap & perfumes add to the chances of cancer?,I would think we add way to much to our bodies during the day from the start of our day to our skin which is the largest organ on our body. For instance - the average male gets up goes to shower - uses soap then some form of face wash to shave then adds deodorant and then? See what I mean? Companies like Toms and others promote natural products in the US but has any research been done on the harmful effects we have on our bodies just by our daily routines? Reason? We have all been sold a bill of goods that says we need to look and act a certain way. What if the cultures who don't do that - have it right? Curious.,unproven
1949.0,Is it safe to reuse plastic water bottles?,"Many plastic bottles of water are treated as 'single use' by consumers, one justification being that chemicals from the plastic leach into the water over time. Yet such plastics are known to degrade incredibly slowly, lasting thousands of years. Is there any evidence that refilling and reusing 'single use' plastic bottles of water is unsafe?",TRUE
6812.0,Hospital laboratories falsify positive COVID-19 results,Internet memes based on hearsay claim that hospital laboratories falsify COVID-19 tests to inflate numbers without evidence,FALSE
6810.0,"the COVID-19 pandemic was planned … it’s very clear this virus was manipulated … the virus didn’t jump directly to humans, that’s not how it works, that’s accelerated viral evolution",“Plandemic” vignette featuring anti-vaccination activist Judy Mikovits contains numerous false and unsupported claims about COVID-19,FALSE
